{
  "$schema": "https://json-schema.org/draft/2020-12/schema",
  "$id": "urn:supracraft:schema:causal-capability-manifest:1",
  "title": "SupraCraft causal microscope capability manifest v1",
  "type": "object",
  "additionalProperties": false,
  "required": [
    "schema",
    "adapter_id",
    "minecraft_version",
    "edition",
    "side",
    "java_major",
    "symbol_mode",
    "fail_closed",
    "mapping_provenance",
    "bindings"
  ],
  "properties": {
    "schema": {
      "const": "supracraft-causal-capability-manifest/1"
    },
    "adapter_id": {
      "type": "string",
      "pattern": "^[A-Za-z0-9._-]+$"
    },
    "minecraft_version": {
      "type": "string"
    },
    "edition": {
      "const": "java"
    },
    "side": {
      "const": "dedicated_server"
    },
    "java_major": {
      "type": "integer",
      "minimum": 8
    },
    "symbol_mode": {
      "enum": [
        "obfuscated",
        "mapped",
        "unobfuscated",
        "structural"
      ]
    },
    "fail_closed": {
      "const": true
    },
    "mapping_provenance": {
      "type": "object",
      "additionalProperties": false,
      "required": [
        "repository",
        "commit",
        "mapping_artifact",
        "mapping_blob_sha"
      ],
      "properties": {
        "repository": {
          "type": "string"
        },
        "commit": {
          "type": "string",
          "pattern": "^[0-9a-f]{40}$"
        },
        "mapping_artifact": {
          "type": "string"
        },
        "mapping_blob_sha": {
          "type": "string",
          "pattern": "^[0-9a-f]{40}$"
        }
      }
    },
    "bindings": {
      "type": "array",
      "minItems": 1,
      "items": {
        "type": "object",
        "additionalProperties": false,
        "required": [
          "id",
          "event_family",
          "runtime_class",
          "runtime_method",
          "runtime_descriptor",
          "semantic_symbol",
          "expected_bind_count"
        ],
        "properties": {
          "id": {
            "type": "string",
            "pattern": "^[A-Za-z0-9._-]+$"
          },
          "event_family": {
            "type": "string"
          },
          "runtime_class": {
            "type": "string"
          },
          "runtime_method": {
            "type": "string"
          },
          "runtime_descriptor": {
            "type": "string"
          },
          "semantic_symbol": {
            "type": "string"
          },
          "expected_bind_count": {
            "const": 1
          }
        }
      }
    }
  }
}
